<?xml version="1.0" encoding="UTF-8" standalone="no"?>
<Credential xmlns="http://www.zurich.ibm.com/security/idemix" xmlns:xs="http://www.w3.org/2001/XMLSchema" xmlns:xsi="http://www.w3.org/2001/XMLSchema-instance" xsi:schemaLocation="http://www.zurich.ibm.com/security/idemix Credential.xsd">
  <References>
    <CredentialStructure>http://www.zurich.ibm.com/security/idmx/v2/testIssuer/CredStruct1a.xml</CredentialStructure>
  </References>
  <Attributes>
    <Attribute name="attr1">
      <Value>13256785678</Value>
    </Attribute>
    <Attribute name="attr2">
      <Value>0</Value>
    </Attribute>
    <Attribute name="attr3">
      <Value>0</Value>
    </Attribute>
    <Attribute name="attr4">
      <Value>0</Value>
    </Attribute>
  </Attributes>
  <Signature>
    <A>18110932031993794686989674892235866559154499957898128668676525335647622737399140835860852047307074389009269659839194207935989414494966795031268227562277524542437752664649227643382796529132701409129472527112669516058923041879911962886939103126914635942584080899156532397344148004193689997580493553194608256517</A>
    <e>259344723055062059907025491480697571938277889515152306249728583105665800713306759149981690559193987143012367913206299323899696942213235956742930316040331215474863234775744194396997</e>
    <v>22268413932971662190106124902924343836301603730116887106967540413863968275027353193727224690342065321258172380782215896317446239663436755705998318873192382894132662991903130999782149252201692288268745196341267422918963272080898884614447780774795507865233335600371501771294905879713447341547642498349562377246883640030916289545906904031307931262437019442030822983857398088796246317516494402603285052441562435226450780488910189752875286693675068352528610672728006547056462784033537076463934914223554060940637903556489718828881437600697187388278148256704935155541299439910310040571571828370898072060963605484599866718988</v>
  </Signature>
  <Features/>
</Credential>
